{
  "$schema": "./implementations.schema.json",
  "version": "1.1",
  "description": "MoQT implementation registry for interop testing",
  "current_target": "draft-18",
  "implementations": {
    "aiomoqt": {
      "name": "aiomoqt",
      "organization": "MarzResearch",
      "repository": "https://github.com/gmarzot/aiomoqt",
      "draft_versions": [
        "draft-14",
        "draft-16",
        "draft-18",
        "draft-20",
        "draft-22"
      ],
      "notes": "Python asyncio implementation of MoQT. Supports draft-14, draft-16, draft-18, draft-20 and draft-22. Without DRAFT the client probes SETUP newest first (22 -> 20 -> 18 -> 16 -> 14) and pins the first draft that completes; DRAFT pins one draft or sets the probe order. Runs the data-plane data-subgroup-basic scenario and rendezvous-timeout (draft-18 and later; SKIP below).",
      "roles": {
        "client": {
          "confine": {
            "env": {
              "DRAFT": "${MOQT_DRAFT_NUM}"
            }
          },
          "docker": {
            "image": "ghcr.io/gmarzot/aiomoqt:latest",
            "notes": "Pre-built on GHCR from the upstream repo (see Dockerfile at the repo root). :latest tracks stable releases."
          }
        }
      }
    },
    "aiomoqt-relay": {
      "name": "aiomoqt (relay)",
      "organization": "MarzResearch",
      "repository": "https://github.com/gmarzot/aiomoqt",
      "draft_versions": [
        "draft-14",
        "draft-16",
        "draft-18",
        "draft-20",
        "draft-22"
      ],
      "notes": "aiomoqt interop relay (draft-14/16/18/20/22): SETUP, PUBLISH_NAMESPACE, PUBLISH, SUBSCRIBE and FETCH, forwarding objects; RENDEZVOUS_TIMEOUT on draft-18 and later. One UDP port serves raw QUIC and WebTransport, chosen by ALPN; the docker entry is tested over raw QUIC, the open relay over both.",
      "roles": {
        "relay": {
          "confine": {
            "env": {
              "DRAFT": "${MOQT_DRAFT_NUM}"
            }
          },
          "docker": {
            "image": "aiomoqt-interop-relay:latest",
            "url": "moqt://relay:4443",
            "endpoints": [
              { "url": "moqt://relay:4443", "transport": "quic" },
              { "url": "https://relay:4443", "transport": "webtransport" }
            ],
            "build": {
              "dockerfile": "adapters/aiomoqt/Dockerfile.relay",
              "context": "adapters/aiomoqt"
            },
            "upstream_image": "ghcr.io/gmarzot/aiomoqt:latest",
            "notes": "Adapter pins relay mode + both transports on one port (MOQT_DUAL=1) + draft-22/20/18/16/14 on the /certs convention (MOQT_ROLE=relay)."
          },
          "remote": [
            {
              "url": "moqt://aiomoqt-relay.marzresearch.net:4443",
              "transport": "quic",
              "notes": "Open interop relay (no auth; bounded per-track cache of 8 groups / 32 MB, serves FETCH), tracks the aiomoqt development branch. Drafts 22/20/18/16/14. IPv4 only."
            },
            {
              "url": "https://aiomoqt-relay.marzresearch.net:4443/",
              "transport": "webtransport",
              "notes": "Same relay as the moqt:// entry, over WebTransport."
            }
          ]
        }
      }
    },
    "imquic": {
      "name": "imquic",
      "organization": "Meetecho",
      "repository": "https://github.com/meetecho/imquic",
      "draft_versions": [
        "draft-22",
        "draft-21",
        "draft-20",
        "draft-19",
        "draft-18",
        "draft-17",
        "draft-16"
      ],
      "notes": "C implementation. Supports draft-22 and lower, down to draft-16, via version negotiation. Draft-22 support added October 2026.",
      "roles": {
        "relay": {
          "remote": [
            {
              "url": "https://lminiero.it:9000",
              "transport": "webtransport"
            },
            {
              "url": "moqt://lminiero.it:9000",
              "transport": "quic"
            }
          ],
          "docker": {
            "image": "ghcr.io/englishm/moq-interop-runner-imquic-moq-relay:latest",
            "endpoints": [
              { "url": "moqt://relay:4443", "transport": "quic" },
              { "url": "https://relay:4443", "transport": "webtransport" }
            ],
            "notes": "Build from source: ./builds/imquic/build.sh --target relay (published to GHCR via build-images.yml)"
          }
        },
        "client": {
          "docker": {
            "image": "ghcr.io/englishm/moq-interop-runner-imquic-moq-interop-test:latest",
            "notes": "Build from source: ./builds/imquic/build.sh --target client (published to GHCR via build-images.yml)"
          }
        }
      }
    },
    "libquicr": {
      "name": "libquicr",
      "organization": "Cisco",
      "repository": "https://github.com/Quicr/libquicr",
      "draft_versions": [
        "draft-18"
      ],
      "notes": "C++ implementation",
      "roles": {
        "relay": {
          "remote": [
            {
              "url": "https://us-west-2.relay.quicr.org:33437/relay",
              "transport": "webtransport",
              "tls_disable_verify": true,
              "notes": "WebTransport endpoint"
            },
            {
              "url": "moqt://us-west-2.relay.quicr.org:33437",
              "transport": "quic",
              "tls_disable_verify": true,
              "notes": "Raw QUIC endpoint"
            }
          ]
        }
      }
    },
    "moq-dev-js": {
      "name": "moq (moq-dev, JS)",
      "organization": "Luke Curley",
      "repository": "https://github.com/moq-dev/moq",
      "draft_versions": [
        "draft-14",
        "draft-15",
        "draft-16",
        "draft-17",
        "draft-18"
      ],
      "notes": "Bun/TypeScript test client using @moq/net npm package with @moq/web-transport polyfill. Supports all moq-transport draft versions 14+ via version negotiation.",
      "roles": {
        "client": {
          "docker": {
            "image": "ghcr.io/englishm/moq-interop-runner-moq-dev-js-client:latest",
            "notes": "Pre-built on GHCR. To build from source: ./builds/moq-dev-js/build.sh && docker tag moq-dev-js-client:latest ghcr.io/englishm/moq-interop-runner-moq-dev-js-client:latest"
          }
        }
      }
    },
    "moq-dev-rs": {
      "name": "moq (moq-dev)",
      "organization": "Luke Curley",
      "repository": "https://github.com/moq-dev/moq",
      "draft_versions": [
        "draft-14",
        "draft-15",
        "draft-16",
        "draft-17",
        "draft-18",
        "draft-19",
        "draft-20"
      ],
      "notes": "Rust implementation by kixelated, supports moq-lite and IETF MoQT. Test client built on moq-net/moq-native. Supports all moq-transport draft versions 14+ via version negotiation.",
      "roles": {
        "relay": {
          "docker": {
            "image": "moq-dev-rs-interop:latest",
            "endpoints": [
              { "url": "moqt://relay:4443", "transport": "quic" },
              { "url": "https://relay:4443", "transport": "webtransport" }
            ],
            "build": {
              "dockerfile": "adapters/moq-dev-rs/Dockerfile.relay",
              "context": "adapters/moq-dev-rs"
            },
            "upstream_image": "docker.io/moqdev/moq-relay",
            "notes": "Adapter wraps upstream image with /certs convention"
          },
          "remote": [
            {
              "url": "moqt://cdn.moq.dev:443/anon",
              "transport": "quic",
              "notes": "Public raw QUIC relay"
            },
            {
              "url": "https://cdn.moq.dev/anon",
              "transport": "webtransport",
              "notes": "Public relay"
            }
          ]
        },
        "client": {
          "confine": {
            "env": {
              "MOQ_CLIENT_VERSION": "moq-transport-${MOQT_DRAFT_NUM}"
            }
          },
          "docker": {
            "image": "ghcr.io/englishm/moq-interop-runner-moq-dev-rs-client:latest",
            "notes": "Pre-built on GHCR. To build from source: ./builds/moq-dev-rs/build.sh && docker tag moq-dev-rs-client:latest ghcr.io/englishm/moq-interop-runner-moq-dev-rs-client:latest"
          }
        }
      }
    },
    "moq-go": {
      "name": "moq-go",
      "organization": "floatdrop",
      "repository": "https://github.com/floatdrop/moq-go",
      "draft_versions": [
        "draft-20"
      ],
      "notes": "Go implementation of MoQT (draft-ietf-moq-transport-20): transport-agnostic session library, single-instance reference relay, and an interop test client. Advertises the moqt-20 ALPN only. Both relay and client images are built in-tree (cmd/relay, cmd/interop-client) and follow the runner conventions.",
      "roles": {
        "relay": {
          "docker": {
            "image": "ghcr.io/englishm/moq-interop-runner-moq-go-relay:latest",
            "endpoints": [
              { "url": "moqt://relay:4443", "transport": "quic" },
              { "url": "https://relay:4443", "transport": "webtransport" }
            ],
            "build": {
              "dockerfile": ".sources/moq-go/cmd/relay/Dockerfile",
              "context": "builds/moq-go/.sources/moq-go"
            },
            "notes": "Build from source: make build-impl IMPL=moq-go BUILD_ARGS=\"--target relay\" (add --local ~/moq-go to use a local checkout)."
          }
        },
        "client": {
          "docker": {
            "image": "ghcr.io/englishm/moq-interop-runner-moq-go-client:latest",
            "build": {
              "dockerfile": ".sources/moq-go/cmd/interop-client/Dockerfile.client",
              "context": "builds/moq-go/.sources/moq-go"
            },
            "notes": "Build from source: make build-impl IMPL=moq-go BUILD_ARGS=\"--target client\" (add --local ~/moq-go to use a local checkout)."
          }
        }
      }
    },
    "moq-rs": {